{
  "$schema": "./quest-chain.schema.json",
  "version": 1,
  "bestiary": "the-long-dark.enemies.csv",
  "acts": [
    {
      "id": "roots_and_rot",
      "name": "Roots and Rot",
      "tags": [
        "grass",
        "earth"
      ],
      "coreGrade": "lesser"
    },
    {
      "id": "the_overgrown_wilds",
      "name": "The Overgrown Wilds",
      "tags": [
        "grass",
        "dark"
      ],
      "coreGrade": "lesser"
    },
    {
      "id": "the_sunken_coast",
      "name": "The Sunken Coast",
      "tags": [
        "water",
        "grass"
      ],
      "coreGrade": "greater"
    },
    {
      "id": "the_frozen_reaches",
      "name": "The Frozen Reaches",
      "tags": [
        "ice"
      ],
      "coreGrade": "greater"
    },
    {
      "id": "the_emberwilds",
      "name": "The Emberwilds",
      "tags": [
        "fire",
        "earth"
      ],
      "coreGrade": "mythic"
    },
    {
      "id": "the_storm_peaks",
      "name": "The Storm Peaks",
      "tags": [
        "electric"
      ],
      "coreGrade": "mythic"
    },
    {
      "id": "the_underearth",
      "name": "The Underearth",
      "tags": [
        "earth"
      ],
      "coreGrade": "mythic"
    },
    {
      "id": "the_shadowed_marches",
      "name": "The Shadowed Marches",
      "tags": [
        "dark"
      ],
      "coreGrade": "legendary"
    },
    {
      "id": "the_dragons_spine",
      "name": "The Dragon's Spine",
      "tags": [
        "dragon",
        "fire"
      ],
      "coreGrade": "legendary"
    },
    {
      "id": "the_dark_lords_citadel",
      "name": "The Dark Lord's Citadel",
      "tags": [
        "dark",
        "dragon"
      ],
      "coreGrade": "legendary"
    }
  ],
  "quests": [
    {
      "id": "mushroom_picking",
      "order": 1,
      "name": "Mushroom Picking",
      "act": "roots_and_rot",
      "power": 80,
      "hook": "Gather a basket of mushrooms from the cave mouth before supper. What could possibly go wrong?",
      "enemies": [
        {
          "cardId": "sporeling"
        },
        {
          "cardId": "cave_roach"
        }
      ],
      "reward": {
        "gold": 150,
        "materials": {
          "lesser_grass_core": 1
        }
      },
      "firstClear": {
        "gold": 190,
        "materials": {
          "greater_grass_core": 1
        }
      },
      "intro": [
        {
          "speaker": "Narrator",
          "text": "The cave mouth is cool and smells of damp earth. You have gathered mushrooms on this ledge a hundred times."
        },
        {
          "speaker": "Narrator",
          "text": "The basket is nearly full when the mushrooms start moving."
        }
      ],
      "outro": [
        {
          "speaker": "Narrator",
          "text": "You climb back into the evening light with a full basket and a new suspicion: the hill is awake."
        }
      ]
    },
    {
      "id": "the_whispering_shaft",
      "order": 2,
      "name": "The Whispering Shaft",
      "act": "roots_and_rot",
      "power": 210,
      "hook": "The shaft exhales a sound like whispered names. You go down to find out whose.",
      "enemies": [
        {
          "cardId": "whisper_bat"
        },
        {
          "cardId": "dust_skitter"
        }
      ],
      "reward": {
        "gold": 360,
        "materials": {
          "lesser_grass_core": 1
        }
      },
      "firstClear": {
        "gold": 450,
        "materials": {
          "greater_grass_core": 1
        }
      },
      "intro": [
        {
          "speaker": "Narrator",
          "text": "The shaft breathes out a sound like your own name, spoken by someone who has never met you."
        },
        {
          "speaker": "Narrator",
          "text": "Rope in hand, you go down to meet the voice."
        }
      ],
      "outro": [
        {
          "speaker": "Narrator",
          "text": "The whispering stops the moment the fight ends. Whatever was speaking will not say it again."
        }
      ]
    },
    {
      "id": "gloomcap_hollow",
      "order": 3,
      "name": "Gloomcap Hollow",
      "act": "roots_and_rot",
      "power": 370,
      "hook": "Where the light fails, the mushrooms glow — and so do the eyes watching them.",
      "enemies": [
        {
          "cardId": "gloomcap_sentinel"
        },
        {
          "cardId": "pale_grub"
        }
      ],
      "reward": {
        "gold": 590,
        "materials": {
          "lesser_grass_core": 1
        }
      },
      "firstClear": {
        "gold": 740,
        "materials": {
          "greater_grass_core": 1
        }
      },
      "intro": [
        {
          "speaker": "Narrator",
          "text": "The tunnel opens into a hollow lit by pale mushrooms, each cap glowing like a held breath."
        },
        {
          "speaker": "Narrator",
          "text": "Between the caps, a dozen small lights blink — and none of them are mushrooms."
        }
      ],
      "outro": [
        {
          "speaker": "Narrator",
          "text": "With the guardians gone, the hollow's glow settles into something almost gentle."
        }
      ]
    },
    {
      "id": "the_mycelium_warren",
      "order": 4,
      "name": "The Mycelium Warren",
      "act": "roots_and_rot",
      "power": 555,
      "hook": "The tunnel walls are threaded with white filaments — and the filaments are listening.",
      "enemies": [
        {
          "cardId": "mycelium_weaver"
        },
        {
          "cardId": "spore_spitter"
        },
        {
          "cardId": "rotling"
        }
      ],
      "reward": {
        "gold": 850,
        "materials": {
          "lesser_grass_core": 1
        }
      },
      "firstClear": {
        "gold": 1060,
        "materials": {
          "greater_grass_core": 1
        }
      },
      "intro": [
        {
          "speaker": "Narrator",
          "text": "White filaments thread every wall of the warren, trembling whenever you speak."
        },
        {
          "speaker": "Narrator",
          "text": "The deeper you go, the less the tunnel feels like a passage and the more it feels like a throat."
        }
      ],
      "outro": [
        {
          "speaker": "Narrator",
          "text": "You cut your way free, but the filaments have already carried word of you onward."
        }
      ]
    },
    {
      "id": "the_capfather",
      "order": 5,
      "name": "The Capfather",
      "act": "roots_and_rot",
      "power": 760,
      "hook": "Something enormous stirs where the warren turns deepest. The mushrooms were only its fingers.",
      "enemies": [
        {
          "cardId": "capfather",
          "elite": true
        },
        {
          "cardId": "rootling",
          "count": 2
        }
      ],
      "reward": {
        "gold": 1120,
        "materials": {
          "lesser_grass_core": 1
        }
      },
      "firstClear": {
        "gold": 1400,
        "materials": {
          "greater_grass_core": 1
        }
      },
      "intro": [
        {
          "speaker": "Narrator",
          "text": "The warren turns deepest here, and the floor trembles in a slow, patient rhythm."
        },
        {
          "speaker": "Narrator",
          "text": "What you fought before were fingers. This is the hand."
        }
      ],
      "outro": [
        {
          "speaker": "Narrator",
          "text": "The Capfather falls, and the warren goes quiet for the first time since you entered it."
        }
      ]
    },
    {
      "id": "down_the_rootwell",
      "order": 6,
      "name": "Down the Rootwell",
      "act": "roots_and_rot",
      "power": 985,
      "hook": "The cave's roots drop away into black water. You climb down anyway.",
      "enemies": [
        {
          "cardId": "root_gnawer"
        },
        {
          "cardId": "blind_mole"
        }
      ],
      "reward": {
        "gold": 1410,
        "materials": {
          "lesser_grass_core": 1
        }
      },
      "firstClear": {
        "gold": 1760,
        "materials": {
          "greater_grass_core": 1
        }
      },
      "intro": [
        {
          "speaker": "Narrator",
          "text": "The cave's roots plunge into black water, and the water is far deeper than the hill is tall."
        },
        {
          "speaker": "Narrator",
          "text": "You find a footing on the roots and climb down anyway."
        }
      ],
      "outro": [
        {
          "speaker": "Narrator",
          "text": "You surface on the far bank, dripping and alive. The water keeps its secrets a little less tightly now."
        }
      ]
    },
    {
      "id": "the_blindstream",
      "order": 7,
      "name": "The Blindstream",
      "act": "roots_and_rot",
      "power": 1220,
      "hook": "A river runs under the hill, and it runs the wrong way.",
      "enemies": [
        {
          "cardId": "pale_crawfish"
        },
        {
          "cardId": "silt_crawler"
        },
        {
          "cardId": "drownmoss"
        }
      ],
      "reward": {
        "gold": 1710,
        "materials": {
          "lesser_grass_core": 1
        }
      },
      "firstClear": {
        "gold": 2140,
        "materials": {
          "greater_grass_core": 1
        }
      },
      "intro": [
        {
          "speaker": "Narrator",
          "text": "An underground river crosses your path, and it is flowing uphill, away from the sea."
        },
        {
          "speaker": "Narrator",
          "text": "The current has teeth, but it is the only way forward."
        }
      ],
      "outro": [
        {
          "speaker": "Narrator",
          "text": "The stream carries the last of them away and resumes its impossible climb."
        }
      ]
    },
    {
      "id": "lantern_moss_grotto",
      "order": 8,
      "name": "Lantern Moss Grotto",
      "act": "roots_and_rot",
      "power": 1470,